{
  "sim_time": "2026-09-04T15:20:00Z",
  "assimilated_rmse": 29.55,
  "uncorrected_rmse": 2479.32,
  "improvement_pct": 98.8,
  "ensemble_size": 20,
  "ensemble_spread": 0.0105,
  "drift_mode_enabled": true,
  "history": [
    {
      "sim_time": "2026-09-04T15:10:30Z",
      "assimilated_rmse": 33.75,
      "uncorrected_rmse": 2651.58
    },
    {
      "sim_time": "2026-09-04T15:11:00Z",
      "assimilated_rmse": 19.63,
      "uncorrected_rmse": 2638.09
    },
    {
      "sim_time": "2026-09-04T15:11:30Z",
      "assimilated_rmse": 26.94,
      "uncorrected_rmse": 2658.3
    },
    {
      "sim_time": "2026-09-04T15:12:00Z",
      "assimilated_rmse": 32.11,
      "uncorrected_rmse": 2669.12
    },
    {
      "sim_time": "2026-09-04T15:12:30Z",
      "assimilated_rmse": 23.61,
      "uncorrected_rmse": 2694.47
    },
    {
      "sim_time": "2026-09-04T15:13:00Z",
      "assimilated_rmse": 43.66,
      "uncorrected_rmse": 2702.92
    },
    {
      "sim_time": "2026-09-04T15:13:30Z",
      "assimilated_rmse": 27.94,
      "uncorrected_rmse": 2715.07
    },
    {
      "sim_time": "2026-09-04T15:14:00Z",
      "assimilated_rmse": 26.54,
      "uncorrected_rmse": 2736.65
    },
    {
      "sim_time": "2026-09-04T15:14:30Z",
      "assimilated_rmse": 37.38,
      "uncorrected_rmse": 2760.54
    },
    {
      "sim_time": "2026-09-04T15:15:00Z",
      "assimilated_rmse": 31.82,
      "uncorrected_rmse": 2776.84
    },
    {
      "sim_time": "2026-09-04T15:15:30Z",
      "assimilated_rmse": 19.9,
      "uncorrected_rmse": 2761.68
    },
    {
      "sim_time": "2026-09-04T15:16:00Z",
      "assimilated_rmse": 15.21,
      "uncorrected_rmse": 2742.5
    },
    {
      "sim_time": "2026-09-04T15:16:30Z",
      "assimilated_rmse": 23.17,
      "uncorrected_rmse": 2710.99
    },
    {
      "sim_time": "2026-09-04T15:17:00Z",
      "assimilated_rmse": 18.1,
      "uncorrected_rmse": 2679.31
    },
    {
      "sim_time": "2026-09-04T15:17:30Z",
      "assimilated_rmse": 22.15,
      "uncorrected_rmse": 2647.22
    },
    {
      "sim_time": "2026-09-04T15:18:00Z",
      "assimilated_rmse": 34.96,
      "uncorrected_rmse": 2607.88
    },
    {
      "sim_time": "2026-09-04T15:18:30Z",
      "assimilated_rmse": 32.5,
      "uncorrected_rmse": 2561.0
    },
    {
      "sim_time": "2026-09-04T15:19:00Z",
      "assimilated_rmse": 39.78,
      "uncorrected_rmse": 2534.44
    },
    {
      "sim_time": "2026-09-04T15:19:30Z",
      "assimilated_rmse": 19.24,
      "uncorrected_rmse": 2511.03
    },
    {
      "sim_time": "2026-09-04T15:20:00Z",
      "assimilated_rmse": 29.55,
      "uncorrected_rmse": 2479.32
    }
  ]
}
